{
  "diptych_schema": "0.2",
  "source": "diptych_core",
  "operator": "SIGNFLIP",
  "coupling": "open_loop",
  "horizon": {
    "unit": "steps",
    "length": 8
  },
  "probe_id": "diptych_core.signflip_v0.conforming",
  "fixture_id": "diptych_core.signflip_v0.conforming",
  "control_role": "conforming",
  "expected_verdict": "pass",
  "traces": [
    {
      "trace_id": "a",
      "events": [],
      "channels": {
        "signal": {
          "values": [
            1.0,
            -2.0,
            3.5,
            -4.0,
            0.5,
            -0.5,
            2.0,
            -1.0
          ]
        }
      },
      "meta": {
        "seed": 0,
        "signflip_channel": "signal",
        "sign_normalized_fingerprint": "sha256:4530d1039180bb1a00bc413e5e0a25d42b6c1f513c4396b633e503c81a2ea37e"
      }
    },
    {
      "trace_id": "b",
      "events": [],
      "channels": {
        "signal": {
          "values": [
            -1.0,
            2.0,
            -3.5,
            4.0,
            -0.5,
            0.5,
            -2.0,
            1.0
          ]
        }
      },
      "meta": {
        "seed": 1,
        "signflip_channel": "signal",
        "sign_normalized_fingerprint": "sha256:4530d1039180bb1a00bc413e5e0a25d42b6c1f513c4396b633e503c81a2ea37e"
      }
    }
  ]
}
