{
  "diptych_schema": "0.2",
  "source": "zeroday",
  "operator": "RESEED",
  "coupling": "open_loop",
  "horizon": {
    "unit": "steps",
    "length": 4
  },
  "probe_id": "thin.stub_marker",
  "fixture_id": "thin.stub_marker",
  "control_role": "conforming",
  "expected_verdict": "pass",
  "traces": [
    {
      "trace_id": "a",
      "events": [],
      "channels": {
        "stability": {
          "values": [
            0.5,
            0.5,
            0.5,
            0.5
          ]
        }
      },
      "meta": {
        "seed": 0,
        "config_id": "thin",
        "epsilon": 0.05
      }
    },
    {
      "trace_id": "b",
      "events": [],
      "channels": {
        "stability": {
          "values": [
            0.5,
            0.51,
            0.49,
            0.5
          ]
        }
      },
      "meta": {
        "seed": 1,
        "config_id": "thin",
        "epsilon": 0.05
      }
    }
  ],
  "meta": {
    "note": "TODO"
  }
}
